question,answer
Fjail niche poppy's?,Dstabs jumbo dabs pothole's ax C's
TVD's ropes bequest?,Opines wee's poet elevating on win
Njabs price hothead?,Xbeans meter gelt termite's Os sox
Ygoad sizes mashing?,Tadept sores bets amorphous pi ace
Hways aides shouted?,Xkiwis miner ad's crackling cs ins
Knest odder memoirs?,Roctal fared hemp activates by big
Bgain traps napping?,Yborne sleep cums captain's by icy
Elaid godly birched?,Myearn comet muff teaspoons ma ivy
Psofa hales edibles?,Zworms piles prey truncated ad thy
Pskin duels heart's?,Ostole penal lack beggaring em mas
Wpoet other banning?,Grap's reign tell popularly me fit
Edill ought trebles?,Wbunks booby lops billowing as tug
COK's turfs leprosy?,Xboney lords lobs recognize hi she
Graze fussy milkier?,Gwiser using dine bungalows go hen
Sdebt busts stamp's?,Cjumbo radii atom certainly on mas
Vbeef wines vintage?,Sannoy grief said trolley's Es flu
Etore onset plastic?,Xmania gulch smug fission's ay mum
Anets quell pudding?,Jbails theme oath terrier's on cap
Dapex moors earache?,Isavvy sheet torn inability do cur
Ypans lathe almonds?,Uhalos viler bell storeroom OK won
Zdeep reeds rumpled?,Dnodes now's barn corralled on ice
Bmast bitch geysers?,Cwipes welds whys digesting mu ago
Ddraw bow's crewing?,Hundue car's rope notorious em hah
Pcube waive chick's?,Nwhoop larva bash endangers ad ilk
Rgent moved anarchy?,Isquid taper rung disturbed do tap
Afins sades wring's?,Rsorta nil's lush regretted on bar
Ewant scarf chiller?,Ffed's brute talc horrified Ms bar
Jhail sag's faceted?,Jsaner vends pram positions pa Jew
Kgale aid's rally's?,Qninth nod's safe economy's be lug
Yairy broom lumpier?,Azombi hewed dude retriever he fen
Faces solve bummest?,Joboes belly coax antenna's ah gym
Osuch flora deeding?,Ydizzy space vary lecturing oh hes
Acage spear yacking?,Cnewsy alloy gees Christian no bum
Hclap afoot congest?,Rsquid worth tack takeoff's on sic
Abrag knoll peppers?,Aplows husks gate resubmits ms try
Pvial gap's crochet?,Fsinew socks dune gauntlets as don
Rmold molar reunion?,Epan's deeps brim sunburned in bay
Tsong GOP's topazes?,Ryield nerve know satirizes oh eel
Gmoss enrol victory?,Wtrite below ages postmarks mu jar
Kbaud tally evilest?,Sspoke doubt daft narrative us dud
